{
  "$schema": "http://json-schema.org/draft-07/schema#",
  "title": "AGNT Tool Definition Schema",
  "description": "JSON Schema for defining tools in the AGNT ecosystem",
  "type": "object",
  "required": ["title", "category", "type", "icon", "description"],
  "properties": {
    "title": {
      "type": "string",
      "description": "The display name of the tool"
    },
    "category": {
      "type": "string",
      "enum": ["trigger", "action", "utility", "control"],
      "description": "The category the tool belongs to"
    },
    "type": {
      "type": "string",
      "description": "The unique identifier for the tool type. Format lowercase kebob case: 'tool-type-name'"
    },
    "icon": {
      "type": "string",
      "description": "The icon identifier for the tool"
    },
    "description": {
      "type": "string",
      "description": "A description of what the tool does"
    },
    "authRequired": {
      "type": "string",
      "enum": ["apiKey", "oauth"],
      "description": "The type of authentication required, if any"
    },
    "authProvider": {
      "type": "string",
      "description": "The authentication provider name"
    },
    "parameters": {
      "type": "object",
      "additionalProperties": {
        "type": "object",
        "properties": {
          "type": {
            "type": "string",
            "enum": ["string", "number", "boolean", "array", "object"],
            "description": "The data type of the parameter"
          },
          "inputType": {
            "type": "string",
            "enum": [
              "text",
              "textarea",
              "number",
              "select",
              "checkbox",
              "password",
              "datetime",
              "codearea",
              "readonly",
              "time"
            ],
            "description": "The UI input type for the parameter"
          },
          "inputSize": {
            "type": "string",
            "enum": ["half", "third", "full"],
            "description": "The size of the input field in the UI"
          },
          "options": {
            "type": ["array", "string"],
            "items": {
              "type": "string"
            },
            "description": "Available options for select or checkbox inputs"
          },
          "description": {
            "type": "string",
            "description": "Description of the parameter"
          },
          "default": {
            "type": ["string", "number", "boolean", "array", "object"],
            "description": "Default value for the parameter"
          },
          "value": {
            "type": "string",
            "description": "Fixed value for readonly parameters"
          },
          "conditional": {
            "type": "object",
            "properties": {
              "field": {
                "type": "string",
                "description": "The field name this parameter depends on"
              },
              "value": {
                "type": ["string", "array"],
                "description": "The value(s) of the field that make this parameter visible"
              }
            },
            "required": ["field", "value"],
            "description": "Conditional display logic for the parameter"
          }
        },
        "required": ["description"]
      },
      "description": "The input parameters for the tool"
    },
    "outputs": {
      "type": "object",
      "additionalProperties": {
        "type": "object",
        "properties": {
          "type": {
            "type": "string",
            "enum": [
              "string",
              "number",
              "boolean",
              "array",
              "object",
              "any",
              "null",
              "integer"
            ],
            "description": "The data type of the output"
          },
          "description": {
            "type": "string",
            "description": "Description of the output"
          },
          "properties": {
            "type": "object",
            "additionalProperties": {
              "$ref": "#/definitions/output"
            },
            "description": "Properties of an object output type"
          }
        },
        "required": ["description"]
      },
      "description": "The outputs produced by the tool"
    }
  }
}
